{
  "$schema": "http://json-schema.org/draft-07/schema#",
  "title": "Problem Intake Schema",
  "type": "object",
  "required": [
    "problem_statement",
    "who_is_affected",
    "frequency_signal",
    "intensity_signal",
    "evidence_links",
    "existing_solutions",
    "gap_detected",
    "monetization_potential",
    "confidence_score"
  ],
  "properties": {
    "problem_statement": {
      "type": "string",
      "description": "Clear, specific statement of the problem in 1-2 sentences"
    },
    "who_is_affected": {
      "type": "string",
      "description": "The target audience or persona affected by this problem"
    },
    "frequency_signal": {
      "type": "string",
      "description": "Evidence of how often this problem comes up (daily, weekly, one-time)",
      "enum": ["daily", "weekly", "monthly", "one-time", "recurring", "unknown"]
    },
    "intensity_signal": {
      "type": "string",
      "description": "How painful/desperate users are about this (urgent, annoying, nice-to-have)",
      "enum": ["urgent", "painful", "annoying", "nice-to-have", "unknown"]
    },
    "evidence_links": {
      "type": "array",
      "description": "URLs to sources where this problem was mentioned",
      "items": {
        "type": "string",
        "format": "uri"
      }
    },
    "existing_solutions": {
      "type": "string",
      "description": "What users currently do to solve this problem"
    },
    "gap_detected": {
      "type": "string",
      "description": "What's missing from existing solutions"
    },
    "monetization_potential": {
      "type": "string",
      "description": "How this could make money (subscription, one-time, usage-based, etc.)"
    },
    "confidence_score": {
      "type": "number",
      "description": "Scout's confidence this is a real problem worth investigating",
      "minimum": 0,
      "maximum": 10
    }
  }
}
